id,text,anger,disgust,fear,joy,sadness,surprise
chn_dev_track_b_00001,"I don't know where I got the money, I've been in a hurry lately and I want to make some money.",0,0,0,0,0,0
chn_dev_track_b_00002,"""Autumn and winter harvest, bird language, flower fragrance, you are the head of the Japanese side"".",0,0,0,1,0,0
chn_dev_track_b_00003,"The best way to get rid of the weeds is to cut the leaves, the leaves, the leaves, the leaves, the leaves, the leaves, the leaves, the leaves, the leaves, the leaves, the leaves, the leaves, the leaves, the leaves, the leaves, the leaves, the leaves, the leaves, the leaves, the leaves, the leaves, the leaves, the leaves, the leaves, the leaves, the leaves, the leaves, the leaves, the leaves, the leaves, the leaves.",0,0,0,1,0,0
chn_dev_track_b_00004,"(Whether your last name is Jiang or your last name is Yang, as long as you are a person who is legally qualified in China!) Personal fundraising for this matter, should be put on the stage! Hopefully in the future, you will never have to look at this endless, endless personal fundraising for children, grandchildren and great-grandchildren!",2,0,0,0,0,0
chn_dev_track_b_00005,"I believe you, I'm in the street of Fengyang in Hai Pearl District, my neighbor encountered the same thing as you, notified the male, showed the test, and then in the afternoon someone came and pulled away.",1,0,0,0,0,0
chn_dev_track_b_00006,"<unk> There are definitely external forces, the organizational method is very similar to Hong Kong, they still know the law? <unk> Is this like what they can say?",2,0,0,0,0,0
chn_dev_track_b_00007,"Every encounter in life is fate, there is no right or wrong. Every morning in life is worth the effort, not the delay.",0,0,0,1,0,0
chn_dev_track_b_00008,"In real life it is really like this, bad people are caught and convicted, good people continue to live their lives, plain plain, there is no need to exaggerate too much",0,0,0,0,0,0
chn_dev_track_b_00009,"There is no Gao Qishan not and there is Chen Tai<unk>Xujiang... it is a kind of human existence, Anxin facing is not Gao Qishan, but Gao Qishan and their protective shield behind them<unk> so his ending was destined from the beginning to be sad and glorious<unk>",0,0,0,0,0,0
chn_dev_track_b_00010,"From day to night you know that the public is wrong, the public is ignorant, how can the public go down again? Even breathing is wrong.",3,0,0,0,0,0
chn_dev_track_b_00011,"This year there are no relatives, the boss let the relatives call for New Year's Eve, I didn't call, I don't usually have a meeting, I don't move, why does the Spring Festival need a false greeting, I don't want to say those unreasonable enthusiastic lies",0,0,0,0,1,0
chn_dev_track_b_00012,"""You son of a bitch, remember this train, next time the Chinese won't take you, look what he said"".",2,0,0,0,0,0
chn_dev_track_b_00013,"They think that Yang is innocent, and have been encouraging him to actively try to live his life without the three views, I feel that destroying the three views is not enough to let me express my feelings.",2,1,0,0,0,1
chn_dev_track_b_00014,"But I still envy the talented people, but I'm not jealous, it's better to be yourself, like I used to envy him too.",0,0,0,0,0,0
chn_dev_track_b_00015,"As ordinary people, for us, it doesn't matter if we don't wear masks, we just hope that, whether we are citizens, foreigners or people from other planets, on our land in China, we can enforce the uniform regulations, don't double standards.",1,0,0,0,0,0
chn_dev_track_b_00016,"I really admire people who respect their profession in every way, who don't make excuses, who are precious in this fast-paced and floating circle!",0,0,0,2,0,0
chn_dev_track_b_00017,"This kind of officer is not a minority, the vast majority are just thinking about doing less, not doing more, waiting for promotion or keeping their position, as for the original purpose, the dog has already been fed.",1,1,0,0,0,0
chn_dev_track_b_00018,"People's live broadcasts are about introducing products, talking straightforwardly, his live broadcasts are like Korean girl group's head-scratching, only he has one more bottle in his hand.",0,0,0,0,0,0
chn_dev_track_b_00019,"This is in Beijing, in the countryside cities, finished saying tired, directly locked you in a small black house to reflect yourself go <unk> reflect understand 37 days to let you out, reflect do not understand give you come a disturbance order to you for a year <unk>",1,0,0,0,0,0
chn_dev_track_b_00020,"We're all old and dead, my sister and I are all only children, the relationship of the class, that is, the children born to my father's brothers and sisters, but we still spend the year together, because there are fewer relatives, so we have to cherish my daughter more because she is also the only daughter, I always tell her to cherish her brother and sister, always support each other, help each other.",0,0,0,0,0,0
chn_dev_track_b_00021,"When you look at the number of cases in Shijiazhuang in the next few days, I'm afraid it's going to be explosive.",0,0,1,0,0,0
chn_dev_track_b_00022,"<unk> Winds of change, see you in a state of confusion <unk>",0,0,0,1,0,0
chn_dev_track_b_00023,"September has been a lot of places outbreak of the epidemic, why still postponed? once not postponed do not want? no long vacation, many people will not run wild, do a nine-day long, will it make people misunderstand as the epidemic is fine, can go everywhere? is it not to give the place to the pit? <unk>",2,0,0,0,0,0
chn_dev_track_b_00024,"It's better to ban her from competing, come to the entertainment industry to make money, don't get used to her fighting in the front, go home to be slandered by her countrymen, go home to steal her countrymen's money.",1,0,0,0,0,0
chn_dev_track_b_00025,"Yes, indeed, the price of a county house in a county town can be bought for seven or eight thousand, three or four-tier cities can be bought for ten thousand, why do we have to stick to the price of a house in the north, that house who can afford a billion people have to go half? and now many people are rural one house in a city, per capita living area is a lot <unk>",0,0,0,0,0,0
chn_dev_track_b_00026,"<unk>Abstract interpretation, malicious interpretation, sometimes even normal discussion is treated as inappropriate speech, if this is the case, then it is really to reach the point where a person endangers himself <unk>",0,0,0,0,0,0
chn_dev_track_b_00027,"Doing nucleic acid doesn't work, Beijing has tens of thousands of small sun people every day.",0,0,0,0,0,0
chn_dev_track_b_00028,"When you go to show off, people's dolls will hate you, parents will say you look like everyone else.",0,0,0,0,0,0
chn_dev_track_b_00029,How do you explain the low-risk areas that are still sealed off? I don't understand why the areas that aren't sealed off and have no cases should also be sealed off.,0,0,0,0,0,1
chn_dev_track_b_00030,"Kidnapping is uncomfortable first of all on a sensory level, it's normal to be scolded, but there's also support, you can't just allow supporting opinions to exist.",1,0,0,0,0,0
chn_dev_track_b_00031,"Every time I see a big road sign that says National 5A scenic area, I can't understand, is it really a scenic area? I was sad because I lost my loved ones, and looking at this makes me sadder.",0,0,0,0,2,0
chn_dev_track_b_00032,"The heartbeat of a young man thinks of the wilderness of a midsummer night, burning endlessly, the breeze blowing through the sky.",0,0,0,1,0,0
chn_dev_track_b_00033,"The people commenting are really weird, the people are just a mainstream media, reacting to the mainstream society, you when the people are superhuman",1,1,0,0,0,0
chn_dev_track_b_00034,"This sentence is too absolute... it's easy to let oneself be abused, one's life doesn't necessarily have to be able to find one's own talent!",0,0,0,0,1,0
chn_dev_track_b_00035,"Like me, this willingness to take a break with my family in different provinces and cities, this kind of effort to work overtime so that I can go home and stay for a few more days, the mood is happy, if I don't take a break, the time to come back and take the car is enough to deduct two days.",0,0,0,0,0,0
chn_dev_track_b_00036," It's good, actually the hierarchy should be implemented on the mainland  by the time the advertising is also hierarchical, you should see, see what you can see, how good ",0,0,0,1,0,0
chn_dev_track_b_00037,"At least there is an attitude, in fact most of us are reasonable, strict execution and humanization are not contradictory.",1,0,0,0,0,0
chn_dev_track_b_00038,"More than one place like this, I'm at low risk of going home, I'm told I need three more days for a nucleic acid test, I'm quarantined at home for 14 days, the policy in the village is stricter than in the town, or are some officials afraid to take responsibility, cut it off directly?",1,0,0,0,0,0
chn_dev_track_b_00039,"The end of the world is still a long way off, but the people of the world are still not ready to reflect, she still has fans to raise money, I really wonder if there is such a evil in this world, the people of the world have given their lives, they have forced their own selfish indifference to be whitewashed, the naked evil revealed in this human nature, really surprised me......",2,1,0,0,0,1
chn_dev_track_b_00040,"Don't ignore the meaning of effort, it reflects the value of the majority of people more than you think talent does.",0,0,0,0,0,0
chn_dev_track_b_00041,"If you don't work hard, your talents will disappear, and you'll have to work hard, work hard, work hard, work hard, work hard, work hard, work hard, work hard, work hard.",0,0,0,1,0,0
chn_dev_track_b_00042,"I don't know if this officer has any relatives who have returned home, if so, it's not considered malicious return home, shouldn't it be quarantined first, in detention?",1,1,0,0,0,0
chn_dev_track_b_00043,"Type-C's design is far worse than Apple's, Apple is two-sided contact, Type-C is four-sided outer plus iron peel circle, large, poor stability",0,0,0,0,0,0
chn_dev_track_b_00044,"The best distance between us is from the audience to the stage, please don't tempt me anymore.",0,0,0,2,0,0
chn_dev_track_b_00045,"How did the riots caused by the firefighting, confiscation of small workshops, clothing machines, and riots now turn into eating and drinking Lazarus?",1,0,0,0,0,1
chn_dev_track_b_00046,"Alas, the governor of Dong County eats the people's food, so high a salary, so good a welfare, that is to feed the dog, can also feed a piece of loyalty and consideration for the master, but if you feed the governor of Dong County, how can you feed such a king's eight-hearted intestine?",2,1,0,0,0,0
chn_dev_track_b_00047,"I've seen it before, the fish in the previous issue, the skin, the metal, the glitter, the sea elf, the angry ghost, the disgust, the two of them sleeping next to each other. Is that okay? The picture looks good, but the plot is really too weak, the tail is too weak, the red card is a surprise.",0,2,0,0,0,1
chn_dev_track_b_00048,"I was going to wish that I could have the power to protect you, but then I felt it wasn't good enough, so I changed it to ""you'll always be so successful that you won't need anyone's protection"".",0,0,0,1,0,0
chn_dev_track_b_00049,"The county is at the intersection of the Yangtze River, the population density is higher than the provincial average, the per capita GDP is lower than the provincial average, in short, the poor county has a high epidemic prevention pressure, and since January 4th, foreigners are prohibited from entering, facing someone who threatened to shoot back, the county governor made a statement that provoked public anger!",1,0,0,0,1,0
chn_dev_track_b_00050,"High one, lunch, bedroom on the sixth floor, at the time of the earthquake none of our bedrooms reacted, still saying that the wall was so strong, wait until it didn't shake, then go down, at that time the coordinates, the bar in the middle",0,0,2,0,0,0
chn_dev_track_b_00051,"Let some Hubeians go back (I mean some not all, without geographical discrimination), many rental houses in the city and the countryside are theirs, these second-hand landlords are sucking the blood",1,1,0,0,0,0
chn_dev_track_b_00052,"Although the show seems to be on fire lately, but since there are no members of the Aichi Art Society, I thought it was a good idea not to watch it.",0,0,0,0,1,0
chn_dev_track_b_00053,"Losing a child, parents must be sad, but this is not a reason for parents to avoid legal responsibility as adults and guardians of children. No identity should be a crime against the law. No protection should be given to children because of the coat of the parents, because the motive is good, you can do whatever you want to the child.",1,0,0,0,1,0
chn_dev_track_b_00054,"To keep calling, I called twenty times this morning 12345 to connect <unk> don't call 12320, they don't connect <unk>",0,0,0,0,0,0
chn_dev_track_b_00055,"In what was supposed to be a good unlocking, that bunch of hairy guys are now going to turn the world upside down, needing to be suppressed by force... all we can do in the end is be ourselves, wait for the unlocking (of course we still have to swear until we can't sleep).",2,0,0,0,0,0
chn_dev_track_b_00056,"At the beginning of the first walk relatives, there is indeed this feeling, are the upper one-legged bring us to the upper one-legged year of blessing.",0,0,0,0,0,0
chn_dev_track_b_00057,I'm going back to Yangzhou on the 4th. Notice number 16 to concentrate quarantine. I really can't think of a vacuum period between these days.,0,0,0,0,0,0
chn_dev_track_b_00058,"Peaceful night, the air full of joyful laughter, the cage full of peace all seasons, the fireplace burning the flame of happiness, the chimney bursting with auspicious clouds, the text message full of wishes: Happy Christmas, happy Christmas!",0,0,0,1,0,0
chn_dev_track_b_00059,"There are no details about all the killers, as if killing an individual is simple and easy, chicken rice is nothing, if you don't like it, kill it. This way of deduction is not good for society at all.",1,1,0,0,0,0
chn_dev_track_b_00060,"The second trial result came out and it's not too late, just a little while later, a new round of reversals started, the speed of netizens changing faces is really fast.",0,0,0,0,0,0
chn_dev_track_b_00061,"It's too easy, in fact, the big tiger will finally rebel, even attack the supervisory group, Gao Qian is also strong, how can the black boss so easily believe a daughter under his own hand who was killed, there will definitely be a defense, and in the end either run away or rebel, which is so simple to catch.",0,0,0,0,0,0
chn_dev_track_b_00062,"Self-rejection is because the other party is not qualified, the lawsuit lost because the judge was discriminatory, it's true <unk> I just hope that when the retrial is live <unk>",1,1,0,0,0,0
chn_dev_track_b_00063,"I don't know what it means to teach early, it takes thousands a month to go to that small space to learn in advance what will happen in six months. On weekends I like to take my children to the park to go to nature.",0,0,0,0,0,0
chn_dev_track_b_00064,"I've never been in your story before, I've never been in your story before, I've never been in your story before, I've never been in your story before, I've never been in your story before, I've never been in your story before.",0,0,0,2,0,0
chn_dev_track_b_00065,"It's not impossible either, otherwise you can set up a system or a code, use other wires to charge, limitations.",0,0,0,0,0,0
chn_dev_track_b_00066,"How I see is that the Hubeians are lining up to make nucleic acid for more than two hours, when it's almost time for the locals to come, they can line up directly for them to make, the people who make nucleic acid also have a very bad tone of voice asking the Hubeians to do or not to do, saying that the locals are prioritized, and also saying that the meat bought in a dozen days is stinking, there is no sex. I saw this video of the conversation between the family and the community director",1,0,0,0,0,0
chn_dev_track_b_00067,"The previous paragraph said that the new crown temporarily damages the male sexual function, now there are gynecological problems that cause the female to appear, the more you look at this new crown the less it looks like a good person?",0,0,1,0,0,0
chn_dev_track_b_00068,"Remember, the motor vehicle crew is equipped with a ""one-man, three-man"" crew, sometimes with a passenger police officer or a security guard.",0,0,0,0,0,0
chn_dev_track_b_00069,"I remember clearly that afternoon, I was sitting in the first row, in the English class, the head of the class was the English teacher, I was blank with one look <unk> I don't know what was going on, the classmates in the back all said that I was just a little confused <unk> the teacher said she thought I had kicked her lecture table <unk> <unk>",0,0,0,0,0,0
chn_dev_track_b_00070,"It's all in an office, someone else has done nucleic acid, take the green code and go back to their home in Anhui, Shandong, Xinjiang, Inner Mongolia, spend the year, I'm from Henan, can't I? How, are Henan people more likely to spread the virus?",1,1,0,0,0,1
chn_dev_track_b_00071,"I've been pulling my stomach for three days, except for the anti-diarrhea medicine. I can't pull my stomach, but my stomach hurts, I want to pull it, but I can't pull it out.",0,0,0,0,2,0
chn_dev_track_b_00072,"I'm a little reluctant to release my negative energy in the rhythm of various social media, people who complain too much and don't need to think about how to live with the blockade at home more meaningfully, usually don't have time to do it now you can do it, usually don't have time to care about the family now you can watch the drama chat chat play cards, really don't know how to sleep peacefully can only complain, when not blocked also live unhappy",1,1,0,0,0,0
chn_dev_track_b_00073,"<unk>Others have reasons to support her, I also have the right not to support her<unk> <unk>Come up and greet others<unk> Abuse others, I think life is also very fond of attacking others<unk> Judge others <unk> Then why come to my Weibo below?",2,1,0,0,0,0
chn_dev_track_b_00074,He seems to be like a man who has lost his temper...... he doesn't even know himself <unk> he still feels like he has to make a grown-up pee wet <unk>,0,1,0,0,0,0
chn_dev_track_b_00075,"Half a month ago, no one deleted the post, because it's not a Cantonese post?! There is no windproof wall",1,0,0,0,0,1
chn_dev_track_b_00076,"No, look, the people who are doing the destruction are forking out, announcing dissatisfaction what's the use, so desperate to solve the problem, applying for volunteers ah, the first-line staff is severely understaffed, you say what the effect can be like",1,0,0,0,0,0
chn_dev_track_b_00077,A decade of journey Every step is a thorn Every step is a sweat,0,0,0,1,0,0
chn_dev_track_b_00078,"Three-four-line towns and villages, lack of people, lack of money, no way to do precise prevention, or try not to go back to the heat, can make a mistake, try to make a mistake.",0,0,0,0,0,0
chn_dev_track_b_00079,"This is a false propaganda, their drink is not effective from childhood to adulthood.",0,0,0,0,0,0
chn_dev_track_b_00080,"I'm in Hai Pearl! This gang doesn't like the cuisine, the quarantine is not advanced, the volunteers are moved to the rice-filled land, is this a person?!!!! Guangzhou really doesn't suit them.",2,0,0,0,0,0
chn_dev_track_b_00081,"A tribute to the brave and fearless Chinese pioneers! Today's prosperity of China is your blood, your life, your mountains, your rivers, your people, your wealth, your return!",0,0,0,2,0,0
chn_dev_track_b_00082,"""Efforts are not worth mentioning, but how many people are born with talents?"" ""Yes, so ordinary people still try"". ""God bless these people"".",1,1,0,0,0,0
chn_dev_track_b_00083,"Now, there are two only ones that have always echoed in my ears: the only one I know is that I know nothing, the only one we fear is fear itself.",0,0,0,0,0,0
chn_dev_track_b_00084,"I'm afraid of the Nanjing subway. That time, a foreigner is a foreigner! Not to mention that the natives are prioritized, equal treatment will not make people so angry.",2,0,0,0,0,0
chn_dev_track_b_00085,"Look at the people of Yunnan who stayed in Xi'an!!! Low risk to go back, you have to concentrate quarantine for 14 days it's too hard",2,0,0,0,2,0
chn_dev_track_b_00086,"The master of the layer is in Beijing, what's the use of you in Wuhan delivering normal medicine normally? Why don't you stand on the shore and make fun of the people in the water?",1,1,0,0,0,0
chn_dev_track_b_00087,"Yang Yang has never raised money from an open account, many netizens have given it to her voluntarily, she came out and said thank you.",1,0,0,0,0,0
chn_dev_track_b_00088,"Don't think about it, it's impossible, with Android you can make money with a data line, people can make money with their fingers?",1,0,0,0,0,0
chn_dev_track_b_00089,"Can we report anything? Not practicing really hurts the hearts of these ordinary people. Although it's Longgang district, but the streets we live in are low risk, and the nucleic acid has been done many times. We haven't been to those middle risk streets either.",1,0,0,0,1,0
chn_dev_track_b_00090,"Don't be an official without ability, don't be an official when you can be an official of an entire place and prove your ability, when you are on top and say don't compare yourself to the official of a big city, what are you doing? If you don't have the ability to improve your ability, if you can't improve it, change people, being an official is not a job that should be enjoyed, for the people to suffer and work hard is exactly what this profession should do and is a place worthy of respect, people's officials should not find any excuses, sell red roses or go home.",2,1,0,0,0,0
chn_dev_track_b_00091,"You are the flower that blooms in the night, strong, beautiful, in my heart you bring out a ray of dawn, you light up the whole world, you bring out the joy that cannot be defended.",0,0,0,2,0,0
chn_dev_track_b_00092,"Don't use these accounts, it's no use, if you really care about it, there will be no one underneath you, tell the truth, that is, be silent. Occasionally jump out and say two sentences, let the people's hearts warm, hope for thirst.",1,1,0,0,0,0
chn_dev_track_b_00093,"This is 2022, you thought it was 1992, you can't take pictures, you can't say, you can't see.",1,0,0,0,0,0
chn_dev_track_b_00094,"Before I went to experience a morning lesson of Meiji's <unk> too deep, all kinds of high-end packaging, the course is tightly packed, the intensity is high, the lessons are more than 10,000, below this price people do not sell lessons <unk> or the only listed morning lesson company in the country Meiji's earnings, net profit 60% <unk> haha, IQ tax ah, take care of yourself <unk> early lessons are more beneficial to the growth of children <unk>",1,1,0,0,0,0
chn_dev_track_b_00095,"Well, there are still some people who are firmly committed to the beginner's attitude, who are professional in creating good works, and there are still some people who appreciate and promote it.",0,0,0,2,0,0
chn_dev_track_b_00096,"Last year because of the graduation paper, I didn't go home. This year because of the epidemic, low risk, but some people can't go home. They are locked up, I thought that the work in Yangzhou could be closer to home, after all, the high-speed train arrived in more than 20 minutes. I didn't expect it, because of the epidemic, the way home became inaccessible. At the beginning of the epidemic, the head of the village of Henan was praised, two years passed, our distance from the epidemic seemed unchanged, but the distance from home was getting further and further.",0,0,0,0,2,0
chn_dev_track_b_00097,"If everyone who commits a crime can raise money for a fine like this, what is the meaning of the punishment?",1,0,0,0,0,0
chn_dev_track_b_00098,"This master is also innocent, water is dead if someone else gives you a bottle of water you drink yourself is dead do you still resent giving water?",0,0,0,0,0,1
chn_dev_track_b_00099,"He's constantly experimenting, challenging himself, and you can see in him the vibrant vitality and the natural energy of the morning!",0,0,0,1,0,0
chn_dev_track_b_00100,"The Pearl of the Sea area has been sealed off for a month, the main thing is that they are not cooperating with the epidemic prevention work, last night there was also a chaos, someone attacked the epidemic prevention personnel, finally the special police came out.",0,0,0,0,0,0
chn_dev_track_b_00101,"It was a pleasure to pass the martyrs' mausoleum, to see a spectacular scene, to see a group of excited hearts welcoming the martyrs home, to see the souls return home.",0,0,0,2,0,0
chn_dev_track_b_00102,"Influenced by the seven fairies of joy, he threw the flowers from the air, hurried over, pretended to be a fairy, and brought the blanket from the house to the roof to give us a new home, my parents came back at night to find that the blanket was missing, and then we were both scolded a lot... a lot of things like that.",0,0,0,2,0,0
chn_dev_track_b_00103,"The atmosphere of prohibiting the return of the villain, a bit like what someone said that year, preferably something a thousand not something a hundred! may lead to the abuse of rights, mainly for this reason, gives a very disgusting feeling!",1,2,0,0,0,0
chn_dev_track_b_00104,"Don't lie, how is it possible 9 days, maximum 8 days, early vacation is it, mid-autumn law 1 day, national holiday law 5 days, two days off, Friday put to Thursday, Friday and Saturday to work <unk>",1,0,0,0,0,0
chn_dev_track_b_00105,"This time the epidemic broke out in the middle of the village in Guangzhou, and then this file was found out again, it's hard not to let people wonder if there are ghosts.",1,0,0,0,0,0
