id,text,anger,disgust,fear,joy,sadness,surprise
chn_dev_track_b_00106,"Five days eight hours most companies are like that, your company is not an indication that your company is not working, hurry up and change a job",0,0,0,0,0,0
chn_dev_track_b_00107,"<unk> I don't know what to say <unk> too wavy, too short life <unk> really in regret <unk> too regret <unk>",0,0,0,0,3,0
chn_dev_track_b_00108,"My home is a small county town 20 years old. When I bought it, it was 19,000 square feet. This year it's down to 15,000 square feet.",0,0,0,0,2,0
chn_dev_track_b_00109,"After tonight, you really can't invite Hubeians, tomorrow you have to check if the company has Hubeians, before that I really didn't notice.",0,0,0,0,0,0
chn_dev_track_b_00110,"I'm on duty for the last two days of National Day this year, I'm on duty for the weekend, next weekend it's my turn to be on duty, the next week it's another week, so my next break is already the 22nd of this month, next year I'm on leave for nine days, can I cancel the weekend, can I really die?",2,0,0,0,1,0
chn_dev_track_b_00111,"In China, the death penalty is not so easy, you can say that the law is like a game.",1,0,0,0,0,0
chn_dev_track_b_00112,"On September 2, 1945, the Japanese representative signed the surrender document. 1.28 million Japanese invading troops surrendered to China. To this end, the victory of the Chinese War of Resistance to Japan ended, and the World Anti-Fascist War also ended victoriously.",0,0,0,1,0,0
chn_dev_track_b_00113,"24 years and 10 months, finally the dream is complete, a tribute to the perseverance of the astronauts represented by Deng Qingming.",0,0,0,2,0,0
chn_dev_track_b_00114,"From childhood, I hated the packaging or advertising of coconut trees, people who don't know Chinese look at the packaging and think it's a special drink. It has nothing to do with freedom to wear clothes, it has nothing to do with conservatism, it's low-class, nice men.",1,1,0,0,0,0
chn_dev_track_b_00115,"I don't like to go to relatives, people I see once a year, usually don't even call, once the new year comes, I worry more about my marriage than my parents, I play for your good flag moral kidnapping, usually I go to dry land",1,0,0,0,0,0
chn_dev_track_b_00116,"It seems that the Stone House has not shown the sights that the joker expects, everything is well ordered, how to judge the well ordered.",0,0,0,0,0,0
chn_dev_track_b_00117,"Should most county towns be over 10,000? Without the life of a city, you still want the disease of a city.",1,0,0,0,0,0
chn_dev_track_b_00118,To see you for the first time is a surprise.,0,0,0,2,0,0
chn_dev_track_b_00119,"In fact, if she doesn't do this, the verdict has already been handed down, it is estimated that this piece of work will be slowly forgotten, this trick, and become the focus again.",0,0,0,0,0,0
chn_dev_track_b_00120,"This film, like Lion, is a superb film in my heart!!! If I never see such a film again in the future, if the director can't keep filming it, I'll really be heartbroken!",0,0,0,1,0,0
chn_dev_track_b_00121,"Is it possible to make a Mac with that kind of magnetic absorption? Temporary wired is definitely not going to come out, after all it still needs to restore the mode",0,0,0,0,0,0
chn_dev_track_b_00122,"Recently often run to the hospital to take care of the elderly, the elderly in the hospital are too many <unk> the elderly in the family just catch a cold non-new corona can cause high blood pressure complications stroke <unk> really have to open this mouth absolutely can not stop the car, by the time the whole country has how many elderly, maybe the hospital is not crowded in, it is very possible by the time the young will not necessarily infect but may bring the virus, home contact the elderly <unk> hard to imagine <unk>",0,0,2,0,0,0
chn_dev_track_b_00123,Have you noticed that our modern human environment is gradually beginning to show up? There is no way to reveal any part of the neck below the neck and the thought of writing and speaking a lot of avoiding (replacing with consonants),0,0,0,0,0,0
chn_dev_track_b_00124,"I didn't give her any money, I also felt that Yang Yang couldn't get out of the way, and she cursed Jiang Guo's mother, which must have been bad, but Jiang Guo's mother always had a feeling that she didn't want to let the heat fall, every year she searched for the heat, there must be a limit to making money with her dead daughter.",1,1,0,0,0,0
chn_dev_track_b_00125,"When he first saw the young man, his eyes were like stars, and he hated why he had known the young man so late.",0,0,0,2,0,0
chn_dev_track_b_00126,"It's not too little, it's not too much, it's not too much, it's not too much, it's just that you're there.",0,0,0,2,0,0
chn_dev_track_b_00127,"Please bring these people as illegal immigrants suspects to the police station, verify their documents etc. After investigating clearly, decide to release them",1,0,0,0,0,0
chn_dev_track_b_00128,"It's probably the 24th to go to work, the 29th to the 7th to go to work for 9 days, the 8th to the 14th to go to work for 7 days, and then one day off.",0,0,0,0,1,0
chn_dev_track_b_00129,"In a word, genius is always genius, that's the realm of God, mortal man no matter how hard he tries, he can only run after the ass of God, never catch up with him <unk> in itself has no talent, and the man full of talent stands together, even if it is self-deprecation <unk>",0,0,0,0,1,0
chn_dev_track_b_00130,"In fact, Apple switched to C, still incompatible with Android now, Apple is definitely C2C, Android is still TYPE-A 2C.",0,0,0,0,0,0
chn_dev_track_b_00131,"More than 30 episodes in the show, the audience is upset! The reality is more than 20 years! What a big damage! Anyway, we waited! Sweep this road really, let the road be far! It's too hard!",0,0,0,0,1,0
chn_dev_track_b_00132,"<unk>Nonsense, can the public write this article like you? Is it still called the public? Isn't it the first time that people are afraid of not being able to buy medicine? (don't like to use the word ignorance to describe the public, this is already an overstatement)",2,0,0,0,0,0
chn_dev_track_b_00133,"What Sun Yang lacks is a well-educated agent, and his mother has been dragging his back leg, such a genius Olympic champion should not retire in such a way.",0,0,0,0,1,0
chn_dev_track_b_00134,"Most of the platforms are more expensive than this one, this one is wearing normal and it doesn't leak anything.",0,0,0,0,0,1
chn_dev_track_b_00135,"Be a person who has landscapes in his eyes, dreams in his heart, self-discipline and confidence.",0,0,0,1,0,0
chn_dev_track_b_00136,"The first two days I went home, the village committee people were mean to me, they said to come back and follow the rules, otherwise don't come back.",1,0,0,0,0,0
chn_dev_track_b_00137,"Every thought of the ancestral land is solid gold, remembering the heroes' iron armor cold... but they don't even have iron armor, only cloth cotton... the winter in the long white mountains is really cold... ice and snow, the sky is circling the American warplanes, the dense shells every sound, the comrades next to them fall down many... they can't even drink hot water... it's really heartbreaking.",0,0,0,0,2,0
chn_dev_track_b_00138,"What's wrong is just highlighting the connection between the chest and the rabbit. In fact, the TV station broadcasted a video of the horse teaching gymnastics for more than a year, which is many times larger than the area of this meat. The netizen in front said, ""It's a colleague who did it, partly agree, give you a compliment"".",0,0,0,0,0,0
chn_dev_track_b_00139,"Those officials, yesterday they said there were no local cases xbb, today they say the local cases mainly occurred in October and November? Why is this so?",1,0,0,0,0,1
chn_dev_track_b_00140,"I remember what you said in your old age, I fought a lifetime of war, now enjoy enjoy, how?!...... then play! then dance",0,0,0,1,0,0
chn_dev_track_b_00141,"This practice of the high-speed train staff is really speechless <unk> he is an old foreigner, he can go without a mask? Don't forget, he is now on Chinese soil, who gave him the privilege <unk>",1,0,0,0,0,0
chn_dev_track_b_00142,"When I commented, I had trouble checking Baidu, because Linjiang's Deputy Secretary of the Political and Legal Committee of the Linjiang Dawn is a regular office level! Even the levels are confused, all the Deputy Secretaries of the Political and Legal Committee are regular office level!",1,0,0,0,0,0
chn_dev_track_b_00143,"Oh, this, are you really in the service industry? I think the railway company is a cow, the reason for the epidemic is the return of individual tickets, the return of 258,000 tickets, the central company can't even complain.",1,0,0,0,0,1
chn_dev_track_b_00144,"So there are people who know how to blow up as asymptomatic, beaten by reality to their poor facial skin. Of course, there are also people who help delete posts that are the last of the shameful blankets.",1,1,0,0,0,0
chn_dev_track_b_00145,"How can I say this? I think the words of my son are very true: ""Efforts will lie, but efforts will not be in vain!""",0,0,0,0,0,0
chn_dev_track_b_00146,"It's completely impossible, the money for the charger is all gone, how is it possible to just give up the whole amount of money for the charging accessories?",0,0,0,0,0,1
chn_dev_track_b_00147,"And the general master can't collect the money, this line is supposed to be a life-saving leak of the sky, and the money is crazy? From the money collection you can also see that this is a fake Taoist, black people are wiped out.",2,0,0,0,0,0
chn_dev_track_b_00148,"Going to the queue to do nucleic acid is a matter of minutes, as simple as pulling the urine pulling the urine. Why do some people feel like it's taking their lives?",1,0,0,0,0,1
chn_dev_track_b_00149,"The mountains and rivers are without defects as seen at first sight. He sings to convey love, only wishes the mountains and rivers are without defects, Thai people!",0,0,0,2,0,0
chn_dev_track_b_00150,"Don't report it, does it make sense? Most people don't have nucleic acid, don't they feel embarrassed by this data? Again, self-testing two-way, having a fever at home, where is the physical strength to go for nucleic acid?",2,0,0,0,0,0
chn_dev_track_b_00151,"Zhang's translation is really good, he's a good actor with ideas, he'll collide with the director's opponent, he'll have a spark, he's also designed action scenes in Manjiang Hongri.",0,0,0,1,0,0
chn_dev_track_b_00152,"Old people in real clothes, so many people in public places, everyone else wears masks, you don't wear masks, you do something special!",2,1,0,0,0,0
chn_dev_track_b_00153,The team of Yang Liang did a great job.,0,0,0,2,0,0
chn_dev_track_b_00154,"On the land where they slept for a long time, new shoots have grown. Thousands of sails have sailed on the side of the shipwreck, life is always changing, but they will never be forgotten by us. May the mountains and rivers be safe, the dead rest.",0,0,0,0,2,0
chn_dev_track_b_00155,♪ Meet your love ♪ ♪ See everything in the world ♪ ♪ Feel romantic ♪ ♪ Have you really good ♪ ♪ Have him really good ♪,0,0,0,2,0,0
chn_dev_track_b_00156,"Henan Province Epidemic Prevention and Control <unk> Do the following documents as long as it is a itinerary card with a star even if it is a low-risk area to concentrate quarantine, you say reasonable?",1,0,0,0,0,0
chn_dev_track_b_00157,"This is a very low level of protection, you are the mayor of a municipal level, you belong to the regular hall level, the secretary of the provincial political and legal committee is the deputy secretary, the deputy secretary is the regular hall, the level is the same as the one, the real power is not yet big, what can this be as a protection, at least the high-level has enough to do the protection of the shell.",0,0,0,0,0,0
chn_dev_track_b_00158,Is it possible that people like you are so willing to be locked up for the rest of their lives?,1,0,0,0,0,1
chn_dev_track_b_00159,"You're on stage, my eyes, chasing you, for me, surrounded by the flow of people coming and going, just this floating worldly background of him.",0,0,0,2,0,0
chn_dev_track_b_00160,"""Solving the problem of the three peasants shouted slogans for decades, nothing practical was done, ignoring who, all that was done was superficiality only"" ""the village was merged, the school was a piece of brick, all went to the city to serve the city people"" ""emptying was forced out""",1,0,0,0,1,0
chn_dev_track_b_00161,"The guidance team had been doing it for so long, and finally they caught up with their adopted daughter and son after the internal explosion...",1,0,0,0,0,0
chn_dev_track_b_00162,"Every day as a volunteer, holidays also go, more pain than before, who doesn't want to overcome the epidemic faster, this video is really, obviously self-defeating not to be pushed back by others <unk> psychological darkness <unk>",1,1,0,0,0,0
chn_dev_track_b_00163,"It's useful, this old man's blessings are enjoyed, his life is worth it, his children don't even sit, the children who are raised with money will still have a good life.",1,1,0,0,0,0
chn_dev_track_b_00164,"I'm more shadowy! This is the enjoyment of the ""foreign rule of law"" of the ""Ocean adults"" how dare you go wild! You don't have to pay for the gifts quickly! Sorry! Smoke, tea, candy, snacks, fruit, hospitality!!",2,0,0,0,0,0
chn_dev_track_b_00165,"The meaning behind this video is actually to persuade people who can't afford to buy a house to go to the county town to buy a house in the city can't afford to buy a house in the city can choose the county town, you can't see it for less than ten thousand yuan the countryside also goes to the county town to buy, I acquire rural land, but the price of housing in the city I didn't fall, all go to the county town to buy",1,0,0,0,0,0
chn_dev_track_b_00166,"The current judge, is he punishing evil and good, or is he taking care of the nursing home for interest? The president of the second intermediate people's court in Beijing, Lu Zhihua, did not correct the wrongdoing in accordance with the law, did not act in accordance with the law, came back to play ping-pong in a case of labor dispute, new evidence came out, enough to push the original verdict.",1,1,0,0,0,0
chn_dev_track_b_00167,"My friend in Guo Village is preparing to take away the quarantine, now the quarantine period is almost over, is it possible to continue the quarantine or can it come out, the answers are different, then the Pearl of the Sea area is now strengthening the management, if it can come out, she doesn't know where to go, the Pearl of the Sea wants the red code again <unk>",1,0,0,0,0,0
chn_dev_track_b_00168,"Let's start with 90% asymptomatic data, let's listen to the experts, let's ruin our own reputation, and then let's blame the common people for the experts' constant words.",1,0,0,0,0,0
chn_dev_track_b_00169,"Where did all the oaths you took when you joined the party go? Serving the people is not letting you go home, fearing that the food is not safe, no people you go wherever you go as an official, think about it carefully.",2,0,0,0,0,0
chn_dev_track_b_00170,"It's a bit of a bullying of the common people to have a leader who serves the people, who serves the people, who serves the people, who serves the people, who serves the people.",1,1,0,0,0,0
chn_dev_track_b_00171,"In China, we don't have reliable data on the extent of the spread of the virus strain, whether there are variants or not, we can only rely on the detection of foreign arrivals, no regrets.",0,0,0,0,1,0
chn_dev_track_b_00172,"When I was a thousand kilometers away, the feeling of imminence was so strong that it was hard to imagine the suffering they were experiencing at that time.",0,0,0,0,2,0
chn_dev_track_b_00173,"He's the boy who says he likes to go to extremes, he's the boy who's always chasing the wind, chasing the waves, chasing the blood, he deserves the best of everything!",0,0,0,2,0,0
chn_dev_track_b_00174,Is this leadership's right greater than the law? And there is no crime he says detention is detention?,2,0,0,0,0,2
chn_dev_track_b_00175,What code to bet let everyone see this exquisite egoist whose conscience let the dog eat him,1,1,0,0,0,0
chn_dev_track_b_00176,"""Hulenbel also had to look at the special return to the old house for work, the door of the civil hall did not let me in, look at the itinerary code there is Beijing, immediately and community reporting""",0,0,0,0,0,0
chn_dev_track_b_00177,"True Voice won't be reported on TV, only on social medianow it's the government covering up the eavesdropping, self-deception, so now no one watches TV",1,1,0,0,0,0
chn_dev_track_b_00178,"Dont be happy colleagues are all Huawei users, I myself use a chargerif you change the charger, colleagues always take your charger away",0,0,0,0,0,0
chn_dev_track_b_00179,"I'm not sure if you're familiar with the term ""Jiang-Yu"" or ""Seven Leafs"". There's a website that has a lot of original information on the Jiang-Yu case, including the original police recordings, the original parts of the scrolls that were recalled from Japan after the first trial, and a lot of chat logs of Yang-Yu and Jiang-Yu, Chen-Shi-Feng and Jiang-Au-Lien.",1,0,0,0,0,0
chn_dev_track_b_00180,"The death of Tianlian Xinjiang newspaper, the murder of the murderer Xinjiang newspaper, the death of Tianlian Xinjiang newspaper, the murder of the murderer Xinjiang newspaper, the death of Tianlian Xinjiang newspaper, the murder of the murderer Xinjiang newspaper, the death of Tianlian Xinjiang newspaper, the murder of the murderer Xinjiang newspaper.",3,1,0,0,0,0
chn_dev_track_b_00181,"Heaven and earth have good spirits, long live the millennia, volunteer soldiers return home, loyal souls live forever! People's heroes, never die!",0,0,0,2,0,0
chn_dev_track_b_00182,"There have been four waves of peak periods abroad in the last year, about once every two or three months, this one is already very reference characteristic.",0,0,0,0,0,0
chn_dev_track_b_00183,"Ask me? put it to October 8th! According to my understanding, the 8th is also a day of rest! then it is put for 9 days, then it is 8th to work againI didn't learn to understand language, I didn't learn to understand mathematics",1,0,0,0,0,0
chn_dev_track_b_00184,"How sorry? they're just a bunch of people, they can make money. journalism is just a bowl of rice for them, as far as conscience is concerned. they think maybe it's not that important, because to tell the truth, they'll get caught too.",1,1,0,0,0,0
chn_dev_track_b_00185,"The point is that the coconut tree doesn't even count as a rubber ball, there are so many people dressed like that on the streets? As for the various red carpet shows, isn't that a little bit of a top?",0,0,0,0,0,0
chn_dev_track_b_00186,"Xu Winter explained on the show that this ad was spoken by her, that is, ""from childhood to adulthood"", that is, we want more.",0,0,0,0,0,0
chn_dev_track_b_00187,"Mengdehai is probably gray, he is not interested in money, he is more interested in fame and achievement, it's as if he is...",0,0,0,0,0,0
chn_dev_track_b_00188,"Really can't imagine......The working people of the service work have this mind, I and my friend are hiding at home and hate to add a few more locks to the door",1,0,1,0,0,1
chn_dev_track_b_00189,"Geography lesson, the topic is why Japan has so many volcanic earthquakes, I've remembered the answer all my life, because Japan is in the Pacific Ring of Volcanic Earthquakes.",0,0,0,0,0,0
chn_dev_track_b_00190,"Mo Yan said: ""In a person's lifetime, all you have to do is thank four people: the one who lent you money when you were poor; the one who stood by you when you were poor; the one who shared your boat when you were poor; the one who poured water on the end of tea when you were sick; the rest are guests who nod their heads and rub shoulders!""",0,0,0,0,0,0
chn_dev_track_b_00191,"Just because they haven't been cooperating with the epidemic, causing the social spread of the whole of the Pearl of the Sea to be silenced <unk> are they the only ones who have been sealed?",1,0,0,0,0,0
chn_dev_track_b_00192,Tesla engineers went in and reviewed the code. Was it rigged?,1,0,0,0,0,0
chn_dev_track_b_00193,"The most precious but naked heart, the most moving person is the youthful spirit, the first time I saw the young man of Luoyang, the white fudan, goodbye to the all-powerful dancer host, the brilliant eye <unk> like a star, the interpretation of the double-faced life of the driver and the love of beans, the sight reaches everywhere <unk> is him <unk>",0,0,0,2,0,0
chn_dev_track_b_00194,"Good guy, if it's a Chinese person who doesn't wear a mask on the train, he's detained for a minute for violating the rules of prevention and control, what's the matter with foreigners here?",2,0,0,0,0,0
chn_dev_track_b_00195," year fla getting pale, sensationally make one uncomfortable, rationally to know this is a good thing: spring festival is traditional agricultural society( other words land binding system+confucian culture) human self-brought homeland plot's mixture, curriculum education also implicitly attached to itit should disappear with modern industrial commercial society shock, substituted with community co-honor coexistence cultureand respect culture, should emphasize rational respect instead of unconditional blind obedience",0,0,0,0,0,0
chn_dev_track_b_00196,"The changing infection data is the best evaluation of the prevention and control policy, the rest is blind. In addition, the good and bad of economic development is directly related to the infection data, after all, the lockdown at home, the number of people working is less.",1,0,0,0,0,0
chn_dev_track_b_00197,"May there be beauty in your eyes, love in your heart, meet the beautiful, meet the happy, every day is spring warm flowers open <unk> <unk>",0,0,0,2,0,0
chn_dev_track_b_00198,"In this ""people's May Day Summer Festival, don't be burdened by time, don't be burdened by yourself"" for every day of the day, some call it a day, some call it life ""day is a day, and life is a quality"" life doesn't have to be cool, but you have to have an attitude ""how confident you are, how beautiful life will be!""",0,0,0,1,0,0
chn_dev_track_b_00199,"<unk> Which of the unscrupulous media is the first to lead the traffic to compensate the family, and this bunch of grandchildren is it that they see the chicken and want to touch it? <unk>",2,0,0,0,0,0
chn_dev_track_b_00200,What's wrong with this dress?,1,0,0,0,0,1
