id,text,anger,disgust,fear,joy,sadness,surprise
chn_train_track_b_00646,"A young and powerful figure goes out of the country, to defend our country, and now 70 years later comes back in this form, eyes, respect! We will always remember you, thank you, now we, we must also protect our country!",0,0,0,2,1,0
chn_train_track_b_00647,"The day before the call, it was 14 days of home isolation plus 5 times of nucleic acid, today it's 14 days of home isolation plus 14 times of nucleic acid.",2,1,0,0,0,0
chn_train_track_b_00648,"<unk> The smaller the place, the more things, the more such governing power still wants to keep young people and bring in talent, live should not develop, live should be left behind! <unk>",2,1,0,0,0,0
chn_train_track_b_00649,"If someone reports it, it's weird to report it successfully, then everyone should report it, step on the gas, and go to the whole country wearing headscarves.",1,1,0,0,0,0
chn_train_track_b_00650,"I don't understand, but it's annoying Jiang Qilin, a woman who survived a hysterical loss of a daughter for so many years, all her thoughts are spent on the top, every year there are several of her news, make people look at it and be afraid of it, netizens say it's true, that's what's right, what's wrong, the power of the great as if it's history, it's a household business done by a woman boiling and boiling",1,1,0,0,0,0
chn_train_track_b_00651,"People who want to lie flat, open your eyes and see!!! Those who started not cooperating with the epidemic prevention, do you feel guilty?",2,0,0,0,0,0
chn_train_track_b_00652,"The so-called ""question"" netizens are just individual cases, how many years have they been around, the whole continent and who doesn't know their family style?",0,0,0,0,0,0
chn_train_track_b_00653,"The biggest difference between it and the questionnaire is that one is the questionnaire, one is the questionnaire, one is the questionnaire, one is the questionnaire, one is the questionnaire, one is the questionnaire, one is the questionnaire.",0,0,0,1,0,0
chn_train_track_b_00654,"So what? Why can't the country unify the policy of quarantine in the low-income high schools and low-income areas? The central government doesn't know what the places look like? A little bit of right must be abused, move quarantine for 42 days, what virus can lurk for 42 days? What is the scientific basis for policy making? Why is there no one in charge?",1,1,0,0,0,1
chn_train_track_b_00655,"The Da Hua Purple Pleasure Palace neighborhood, located in the Panyu district of Guangzhou city, is located on Shanxi Road No. 335 <unk> in the current Panyu district's entire area in the silent phase of 202.11.28 constantly there are people from outside the neighborhood entering a residence in the neighborhood, suspected quarantine personnel are preparing to enter <unk> the residential neighborhood is a concentrated living area, there are a large number of young children and the elderly <unk> preferred point of the residential neighborhood, prone to the spread of the epidemic, disregarding the safety of people <unk>",1,0,1,0,0,0
chn_train_track_b_00656,"Talent determines the lower limit, effort determines the upper limit, some people's lower limit is much higher than your upper limit.",0,0,0,0,0,0
chn_train_track_b_00657,"1 Do you think that Gao Qianqiang made him deputy director because he looked like him or because he looked like Mengdehai? There is such a background as An Xin no one dared to move him <unk>2 He had already found out that he had interests in the delivery, but it did not stop him <unk>",0,0,0,0,0,0
chn_train_track_b_00658,"The Pearl of the Sea is to put the confirmed and unconfirmed diagnoses together, the confirmed fever is locked inside with no one inside, there is no need to call.",1,0,1,0,1,0
chn_train_track_b_00659,"ZF, whatever, if the General Directorate of Radio and Television says that once again this brand will disappear from the media forever, if the business says that once again the production license will be directly revoked, will you dare to look at it?",1,1,0,0,0,0
chn_train_track_b_00660,"The walls are full of people pushing really funny ah when the ban was imposed for 8 years, hardly anyone spoke for Sun Yat-sen, heard almost all the accusations criticism and black material now it's the other way around, look again, everywhere is fueling and support what's the matter? really people have a mouth, anyway how is it all people?",1,1,0,0,0,0
chn_train_track_b_00661,"It's just a reward, she didn't raise any money. The kind netizens feel that her six years have not been easy, want to help her out of the predicament and start a new life as soon as possible.",0,0,0,0,0,0
chn_train_track_b_00662,You're lying in the sky on my phone You blink your eyes and it becomes a star in my heart,0,0,0,2,0,0
chn_train_track_b_00663,"In studying abroad Henan child is too difficult, low risk back low risk, community requires school to open proof of school vacation proof before going homeI wrote a proof that I am a student of a school, proof of school vacation, find a school administration teacher who has been on vacation stampschool said: so many years or the first time someone has to stamp proof of school vacation, I thought these information not all can be proved with stamp",1,0,0,0,1,0
chn_train_track_b_00664,"On New Year's Eve, I went home to my cousin's house and talked about the county house, and my cousin said that our team had only two houses that hadn't bought a house in the county town, many of them were empty, and only the elderly would live with their children!",0,0,0,0,0,0
chn_train_track_b_00665,"He wanted to make the Gaoqian road there really a little bit, not on purpose so vague is cut some things, then he went to the hospital to see the then director pulled, then left again, a little bit like letting the director and An Xin rule out the suspicion that he prevented the shutdown <unk>",0,0,0,0,0,0
chn_train_track_b_00666,"He's the boy who says he likes to go to extremes, he's the boy who's always chasing the wind, chasing the waves, chasing the blood, he deserves the best in the world!",0,0,0,2,0,0
chn_train_track_b_00667,"<unk> eggs play, then you will be in the fight, criticize a person a local government horse rise up as a humiliation to the whole regional people, this is your horizontal horizon? Xi'an management jokes are made up of Henan? The whole network including the media question Xi'an riots, you have no problem others can make you problems? <unk>",2,0,0,0,0,0
chn_train_track_b_00668,"the opposition is unreasonable prevention requirements, is endless and inaccurate nucleic acid, unreasonable lockdown, and no one says that the virus does not exist",1,0,0,0,0,0
chn_train_track_b_00669,"After the last year, the price of housing is really cheap, the last time I went to eat, the waiter said how the house is so cheap now, it's still weird that the price of housing in China is expensive, it's probably the flow of the Three and the Great God, this kind of person, even if he sends it for free, he also hates that no one helps him pay the property fee.",1,1,0,0,0,0
chn_train_track_b_00670,"Our whole company has 100 people, their families and friends add up to hundreds, don't report it, you don't have to test for antibodies at home, you're lying flat.",0,0,0,0,1,0
chn_train_track_b_00671,"With the brains of the people of the country, they will invest in real estate, they will have to pay taxes to get a salary.",1,1,0,0,0,0
chn_train_track_b_00672,"To give the child some time to grow up, 2 or 3 years old crying is not very normal, my son is three years old still see other people's things crazy wanting, crying, even rolling on the ground but 4 years old, now he will know restraint, tell him not to do, he will let go or be patient, not too much trouble big crying <unk> early teaching is not early teaching is the second, the child should be happy every day, play health is more important <unk>",0,0,0,0,0,0
chn_train_track_b_00673,"I especially understand, for example, my sister, my sister never does extra lessons, just goes to class to listen to the teacher, doesn't go to school and doesn't see her do homework, doesn't counsel the teacher, in short, nothing, but from childhood to adulthood is the first grade! The first grade!!!!! and I write homework every day until 12 o'clock and then it's not dependent on <unk>",0,0,0,0,0,0
chn_train_track_b_00674,"It means that it's as if there's an extreme dissatisfaction with this phenomenon, that there's 94% of county-level housing prices that are not more than 10,000, too much, that feeling.",1,0,0,0,0,0
chn_train_track_b_00675,"Aren't they all the same people who violate the rules of prevention and control, who maliciously hide their itinerary? A rat's tail broke a pot, returning home normally according to the process, and maliciously not hanging, as long as it is done according to the rules, why malicious?",1,1,0,0,0,0
chn_train_track_b_00676,"I don't think about whether I'll succeed, since I've chosen the far side, I'll only take into account the wind and rain; I don't think about whether the cold wind and rain will come after me, even if the goal is the horizon, leaving the world only a shadow behind.",0,0,0,1,1,0
chn_train_track_b_00677,"It's the same, go and see more words like Chongqing epidemic, Xinjiang, Lanzhou, Zhengzhou, the crows under the sky are generally black!",2,0,0,0,0,0
chn_train_track_b_00678,"I was so disgusted, I started to whine and make rumors that there was a pregnant woman's abortion, I took a web map and started to whisper.",2,2,0,0,0,0
chn_train_track_b_00679,"24 years of training, 24 years of perseverance, originally for this most special space transfer, it's great! Congratulations!",0,0,0,2,0,0
chn_train_track_b_00680,"I immediately asked who the actor was who played the role of Dong Xiao Long after watching the episode. In fact, Lin Jiachuan's face was very familiar, as if he was in some anti-war dramas, that is, not deep enough to remember his name. This time I can remember him, Lin Jiachuan's acting is great!",0,0,0,2,0,0
chn_train_track_b_00681,"It's all on this page, and I'm still trying to figure out how to avoid responsibility!",2,0,0,0,0,0
chn_train_track_b_00682,"At first, the people of Black Sun Yat-sen were afraid that they had contracted the new coronavirus, otherwise they wouldn't have left a stench here.",1,1,0,0,0,0
chn_train_track_b_00683," The possibility of participating again is not great, Sun Yang is probably wronged, but the process and attitude of dealing with this matter is not good..... Yang Ming's emotional business in this regard is the best......",0,0,0,0,0,0
chn_train_track_b_00684,"I hope that you can do the same thing that I want to do, do what you love, work hard for what you love.",0,0,0,2,0,0
chn_train_track_b_00685,The evening breeze of summer blows my hair just as my love for you gently shakes my heartstrings.,0,0,0,2,0,0
chn_train_track_b_00686,"Weibo can't stop pushing this hot search, believe it or not, in a moment of comment, someone will come to insult the star, this mission blog and who doesn't know, the number of ordinary people who forward it, why not start a crowd of netizens who posted about the Myanmar Wenchuan earthquake?",2,1,0,0,0,0
chn_train_track_b_00687,"Three more days, three more days, I'm submissive, can't I not let some risk-free place run with me, closed for a dozen days, who will compensate me for my losses, a dozen days I haven't seen any rain, I don't know why, I'm really submissive",2,0,0,0,0,0
chn_train_track_b_00688,"They are really speechless, they embarrass the face of Hubeians, now I don't even want to admit that I am from Hubei anymore.",0,1,0,0,0,0
chn_train_track_b_00689,"Do you feel that there is no way for the state to take such people? If it goes down like this, there will only be more and more abnormal people in society.",1,0,0,0,0,0
chn_train_track_b_00690,"I participated in the voting that was initiated. Which song gave you strength, which song meant so much to you? I voted for Lin Jun-jae's ""Love and Hope"".",0,0,0,0,0,0
chn_train_track_b_00691,"You're standing there talking and talking, the grassroots must have a lot of nonsense, your criticism of details is also correct, but the more you talk, the more you say, for example, you say strategic importance, tactical contempt, it's a pity that this virus should be tactfully valued, the West doesn't value it strategically?",1,0,0,0,0,0
chn_train_track_b_00692,"No matter how messy those black people are and how they compete with the so-called Spring Festival files, anyway I like to watch Anonymous, this morning I went to the second brush, the silk slipped.",0,0,0,1,0,0
chn_train_track_b_00693," see have teacher comment, say child not willing accommodation problem, personal discretion: psychology inside often will have unconditionally meet child needs theory(but is must have boundaries, separate drooling and宠爱), guarantee child in early age get full sense of security, personality more sound",0,0,0,0,0,0
chn_train_track_b_00694,"How can the public obey the law without abusing their power, without the rule of law of law enforcement, there can be no rule of law in society. If law enforcement officials use more power than the law to enforce the law, how can people believe in the law? If law enforcement officials use power to suppress the law, how can people choose the law?",1,0,0,0,0,0
chn_train_track_b_00695,"I'm going to take my grandmother's cousin to dinner next year. I'm getting married in ten years, my grandmother's relatives are still unfamiliar, and they don't like to move. This year this excuse is good, but next year I'm going to celebrate New Year's Eve, not happy.",0,0,0,0,2,0
chn_train_track_b_00696,"Some people don't deserve to see a good play, they should see a good, ugly, sweet, rotten person and an absolutely bad bad person. A bad person can't have a good side, otherwise they will be told that the values of the film are wrong.",1,0,0,0,0,0
chn_train_track_b_00697,"Wanted to pluck the stars from the sky for you, but found them already in your eyes.",0,0,0,2,0,0
chn_train_track_b_00698,"First, change the policy of cutting a knife. Otherwise, it makes sense. It's a policy without a reason, a policy with a red stamp.",1,1,0,0,0,0
chn_train_track_b_00699,"Yes, my first child went to school a few months early, my second child didn't go to school, it didn't make any sense.",0,0,0,0,0,0
chn_train_track_b_00700,"The 80's were the product of the national banquet, so the glory, now why are you drunk on the low-class route?",1,0,0,0,0,1
chn_train_track_b_00701,"It is mainly the competent authorities who feel that the old and foreigners who travel on high-speed trains do not follow the rules is a low probability event, and such an event will disappear automatically",0,0,0,0,0,0
chn_train_track_b_00702,"Even though it's hard work, but it makes sense, even though most people don't have the talent to fight, and when it comes to reaching a leading position in an industry, everyone here is working hard to get here, and if you want to distinguish between a winner and a loser, you need more talent, especially in the field of art. She is already a leading figure in the film industry, she has already entered the stage of fighting.",0,0,0,0,0,0
chn_train_track_b_00703,I like all your looks.,0,0,0,2,0,0
chn_train_track_b_00704,"My daughter was also using Merlin twice when she was one year old and still had a fever, and finally decided to give her only the child fever suppressant that we have here in the central hospital. When she ate the second pack, she still had a fever, but that night after eating, she had a complete fever suppressant, no more recurrence. Thank God, at that time I was very worried that she had a fever of 39.5 degrees, she couldn't eat anything.",0,0,2,1,1,0
chn_train_track_b_00705,"Because understand, so thank youbecause understand, so strongbecause understand, so try cherish your every know, guard your every decision",0,0,0,2,0,0
chn_train_track_b_00706,"How many hospitals, how many nurses, how many pressure wards, how many outpatients, how many elderly, infirm, disabled, pregnant people in this county, can there be enough personnel deployed in case of an outbreak?",1,0,0,0,0,0
chn_train_track_b_00707,"Zhou Zhou's luck is really right, I'm Zhao Shen's girlfriend is Zhao Zhen, after the quarrel, she broke up with me, I really can't help it, I want to die all the time",0,0,0,0,2,0
chn_train_track_b_00708,"In the highest end field, like making movies, where does Wang Jing of fifty films a year compare to an on-onewang-kong-kamenChongqing forest(of course, Wang Jing if willing well to shoot it will not necessarily be able to chance take heavenly work)in general, I feel talent and effort are not oppositeseffort cannot outride the leading role of talent, talent cannot embed universal valueseffortmaybe a talented person too hard will ignore this lossit's a very complex topic",0,0,0,0,0,0
chn_train_track_b_00709,"Speaking of which, it can be used as a sign to judge whether the anti-Semite has seen the movie: what is said in the movie is very clear, China is against the lottery scheme, against 50% entering the underground city, clearly pointing out that this is against the original intention of construction; but in the end because there are too many countries to do this, so it was not passed.",1,0,0,0,0,0
chn_train_track_b_00710,"""Sue, the one who learned to play the piano, passed the exam, used to play the piano more or less, can't say it's bad because he doesn't understand jazz, can't eat typical grapes, says grape acid"".",1,0,0,0,0,0
chn_train_track_b_00711,"She can go abroad to study. A family like that can't afford 700,000? Really, nothing.",1,0,0,0,0,1
chn_train_track_b_00712," No way, the grassroots staff is the same, especially in our hospital work  every year there is a typhoon  there is a sporadic epidemic, even if it is not related to us, we have to work overtime  we have less time to rest, normally canceling holidays overtime is fine, the year has passed and we do not want to cancel holidays because of the sudden epidemic  we have experienced once  the 2020 Spring Festival on a monthly shift, do not want to experience a second time ",0,0,0,0,1,0
chn_train_track_b_00713,"What's the beginning, I just unlocked it a few days ago, there's not a single rumor online, it's just that now it's worse.",2,0,0,0,0,0
chn_train_track_b_00714,"As of today, the person I've been living with in Fukuoka for five days has become a first-time test positive today, and I'm still negative. I've informed the staff of this situation, but what makes me angry is that the government has so far not dealt with my feedback. The procedure for dragging me to Fukuoka is irregular, refusing my request for a review and nucleic acid, and ignoring the results of my antigen negative, directly isolating me with the positive patients.",2,0,0,0,0,0
chn_train_track_b_00715,"I agree, I studied linguistics, I studied this subject before thinking that I like languages can study hard, then I found out that languages are also a gift I don't have this thing, it's hard to make up for it my three years of time is wasted, so advise future teachers and sisters to choose what they can learn",0,0,0,0,1,0
chn_train_track_b_00716,"For most ordinary people with low incomes, hard work is a steady way to climb up. It's not that hard work can cross class, it's that hard work can at least guarantee the minimum of life. It's that hard work that's not good enough to say that talent is not enough, most of them are too lazy.",1,0,0,0,0,0
chn_train_track_b_00717,"The person who rewards should also know that the money will not come back, no matter how much others spend, hoping that these people will feel guilty when they dream of returning at midnight.",0,0,0,0,0,0
chn_train_track_b_00718,"The first picture started to be messy, after September 25, 2022 XBB came a wave of popularity? Do you really feel that writing long is the truth?",2,0,0,0,0,0
chn_train_track_b_00719,"It's not really a lockdown, it's not really a lockdown, it's better to have a strict control sooner, which companies can stay in the White Cloud area, today the subway is closed, the company says you can go around the Tianhe River and take the subway to work, try to ask questions so that it doesn't spread, it doesn't spread, the consciousness doesn't get in place.",1,0,0,0,0,0
chn_train_track_b_00720,"A talent without effort is a violent thing, a constant effort to hold on to is a talent, a constant effort to blow on talent because it's the simplest thing, a constant effort to try again is a constant grinding of yourself.",0,0,0,0,0,0
chn_train_track_b_00721,"Talent is something that God has given you, people who don't know how terrible talent is have never seen a talented person in the same conditions or even worse conditions can still take you a long way away I have met, but I did not refuse, because in addition to individual talented, there are more people who have neither talent nor effort, I just try better than these people",0,0,0,0,0,0
chn_train_track_b_00722,"They really don't have to go to work, they don't have to be quarantined, they don't have nucleic acid, why do these monkeys always show up?",2,0,0,0,0,1
chn_train_track_b_00723,"Even if you give a reward, it's only a few hundred thousand, six years is a billion in the morning. This one must tell the number I before there's any hope.",0,0,0,0,0,0
chn_train_track_b_00724,I really don't understand why you don't let me go home for the holidays when you're sure you're safe and risk-free.,1,0,0,0,0,1
chn_train_track_b_00725,"In 2019, Guangdong supported 2,200 nurses in Wuhan, in 2022 Hubeians waved their fists, Hubeians played ""The Farmer and the Snake"" very vividly, the whole people of Guangdong remembered it.",2,0,0,0,0,0
chn_train_track_b_00726,"You can say directly, what exactly happened in the village, the facts are, don't be vain, we are not blind, we are not blind. I am currently living in Haiphong, 100 meters below the floor, I have three nucleic acid points, the attitude is good, every day is orderly, the price has not risen, so far there is no material, I believe in Guangzhou, I also believe in the government, and this city is not excluded at all, I am a Wenzhou person.",0,0,0,1,0,0
chn_train_track_b_00727,"I really don't want to get to know you in this way, but now I can only say to you: go your own way!",0,0,0,0,2,0
chn_train_track_b_00728,"Unlocking may be a choice, unlocking does not mean not to protect, but rather individuals should do their best to protect themselves, take their own responsibilities.",0,0,0,0,0,0
chn_train_track_b_00729,"You are a beam of light in my world, run to me, everything grows.",0,0,0,2,0,0
chn_train_track_b_00730,"The day is busy, busy, busy, light; life is fragrant in the rough tea, light rice; life is in the hard frustration, the experience of practice; the mood is in the hundred-tasteful old, calm, if the heart is not sad, the person is not cold; if the heart is not separated, love is not far; if the heart is not hated, the world is warm; if the heart is not cold, the blue sky!",0,0,0,1,0,0
chn_train_track_b_00731,Is there a lawyer who can give me a general law? What should I do if I encounter such a scoundrel later?,1,0,1,0,0,1
chn_train_track_b_00732,"There's no crime, there's no scrubbing the edges, there's no vulgar marketing, why not? On the one hand, there's a lot of censorship, on the other hand, are the netizens who report online too liberal?",1,1,0,0,0,0
chn_train_track_b_00733,"The last time a woman and her child sat next to a high-speed train as if they had forgotten to buy a ticket, the passenger police passenger attendant arrived in one minute and persuaded them.",0,0,0,0,0,0
chn_train_track_b_00734,"My friend in the show, before was second seal, new policy the next day restored green code, canceled second seal, your second seal transfer seal from where and come, don't open your mouth come",1,0,0,0,0,0
chn_train_track_b_00735,"strive to be an ordinary person, seriously do your own thing it's OK, the top people in any industry are just a minority",0,0,0,0,0,0
chn_train_track_b_00736,"Come on, just back off and reiterate, you think you can compete? Do you see the paperwork clearly?",1,0,0,0,0,0
chn_train_track_b_00737,"It's even worse that the students are being spat on when they go home, now the comment section is at peace again, they know it's painful, a group of people are screaming at the students, even if the students are spat on until they die according to the normal policy of returning home.",1,1,0,0,0,0
chn_train_track_b_00738,"Jump, hit stones, play glass beads, tear books, fold triangles, play quadrangles, hide and seek, go up the mountain to pick berries, go down the field to catch mud, play paint, kick, make windmills, make water guns out of bamboo, remember the winter snow battle, the pain of freezing fingers to cry.",0,0,0,2,0,0
chn_train_track_b_00739,"Shenzhen is also under lockdown. If someone gets involved, they give the lockdown fee (to the middle of the city), but the people are not so greedy, they want 200 people a day, Shenzhen is under lockdown for nine days.",0,0,0,0,0,0
chn_train_track_b_00740,"Nostalgia is in the bones of the Chinese, in Shenzhen you go to and from work normally, when you go home you have to be 14+14, it makes you cold.",1,0,0,0,2,0
chn_train_track_b_00741,"Leaders, take a look at the unpaid debt of hundreds of millions of yuan owed by Shandong Eastern Ocean Group Co., Ltd. to its employees.",2,0,0,0,0,0
chn_train_track_b_00742,"Congratulations to the Dream Sky Experimental Cage for its successful launch, and hopefully the Little King will also succeed in redrawing the Dream Night Poster, returning the posture of the Dream Night Poster.",0,0,0,2,0,0
