id,text,anger,disgust,fear,joy,sadness,surprise
chn_train_track_b_01253,"Their friends in Hubei said that they were cheated by the Hubei Chamber of Commerce, they could have given the money back to Hubei, but now the people of the Hubei Chamber of Commerce have run away with the money, the village they used to live in has not received it, and now the Hubei side does not allow them to return, which is equivalent to a two-way street.",1,0,0,0,0,0
chn_train_track_b_01254,"<unk> Young people should do this! <unk> When, where and how should not erase the value and meaning of effort <unk> What values are this preaching?",1,0,0,0,0,0
chn_train_track_b_01255,"identification, talent is more important than effort, choice is also more important than effort, choosing to be talented in something to try hard is hard not to succeed ah",0,0,0,1,0,0
chn_train_track_b_01256,"Cutting grass, playing in the mud, climbing trees, watching cartoons, doing all sorts of farming, the only thing I miss is being outside at night and looking at the stars, and my mother is telling stories next to me.",0,0,0,2,0,0
chn_train_track_b_01257,"<unk> breached, Xi'an students too ah, clearly with the government and school open closed management 30 days, nucleic acid negative more than 20 times proof and return home promise letter, local government response this is your side school government open, not recognized still quarantine 14 days, although not concentrated, but single individual self-defense and how many conditions can be achieved <unk> I really did not expect it would be like this <unk>",1,0,0,0,1,0
chn_train_track_b_01258,"<unk> Stop wages <unk> civil servants at the grassroots level are not officials, let alone rich people, stop wages <unk> immediately will not work, or work is better than not working <unk>",0,0,0,0,0,0
chn_train_track_b_01259,"It turns out that the Chinese law is like this, low-risk returning home for the New Year is a sin!",2,0,0,0,0,0
chn_train_track_b_01260,"We're in a small county town, the price of the house is between 4 and 5 thousand, I don't think it's very expensive, but the salary is too low, so people don't have the confidence to buy a house.",0,0,0,0,1,0
chn_train_track_b_01261,"Walking with relatives is a normal human expression of gratitude, a manifestation of affection, a part of social life, and after 500 years, it's still the same, right?",0,0,0,0,0,0
chn_train_track_b_01262,"I don't care what's going on down there, as long as there's a case, it's that I didn't manage to get in place, your owl hat don't want it anymore.",1,0,0,0,0,0
chn_train_track_b_01263,"Isn't Weibo's basic function to reward Weibo, I see that everyone is using it, how can you use it to raise money, and not let people's families live, to kill people's families every day?",1,0,0,0,0,0
chn_train_track_b_01264,"Who are you, a sharp-edged youth who thinks of the twilight, who wanders in the wilderness of the deserted city, turning into a song?",0,0,0,1,0,0
chn_train_track_b_01265,"We've been in quarantine in Xi'an for over a month, now we can't go home, even if we go home, we have to be quarantined.",1,0,0,0,1,0
chn_train_track_b_01266,"My niece went to kindergarten when she was three months old, the parents accompanied the parents and the children to interact, mainly to give her the opportunity to have more contact with the same age baby, she also enjoyed it, she is currently two years old.",0,0,0,1,0,0
chn_train_track_b_01267,"Is it possible that the people are home? <unk> Check the neighborhood, people outside come and line up, if that's the case don't chase them out it's already good <unk>",1,0,0,0,0,0
chn_train_track_b_01268,"Please, how many days is a few days? <unk> Call to call, the class on the day can not escape, even going to work is really annoying <unk>",1,0,0,0,1,0
chn_train_track_b_01269,"Such statistics are meaningless, before 120 calls a day 5000, recently more than 30,000 a day, these are mostly fever and suffering can not bear it",0,0,0,0,1,0
chn_train_track_b_01270,"As an individual, it's a personal preference, it should be fully respected, but as a company that caters to a wide range of consumer groups, it should not be aesthetic standards that are rigidly projected onto society, say it is nutritious, it is beneficial to the body, it is useful as a propaganda point, it is always focused on the body, what is the matter, this is the target of the masses, deliberately using this thunderbolt aesthetic effect to create a circle.",1,0,0,0,0,0
chn_train_track_b_01271,"I'm an expert in shit, but it doesn't count! 29th, mid-autumn vacation one day, 30th, 1st weekend vacation two days, National Day three days, 2nd, 4th, 5th, 6th, two days of rest, total 8 days, how can there be 9 days, 7th, 8th, 7th, 8th, Saturday, Sunday, I still have to work overtime!",2,0,0,0,0,0
chn_train_track_b_01272,"We are more bizarre there, the price of a house in Shenzhen, a small county town in Guangxi is 9000 yuan.",0,0,0,0,0,1
chn_train_track_b_01273,"think more, live more than two years you know, effort does not necessarily have results, talent is like a seed, there is no real bit of it if there is no effort there is no use there is talent and effort is useful, only effort is not possible",0,0,0,0,0,0
chn_train_track_b_01274,"Don't like to eat equals not delivering supplies, don't cook equals not delivering supplies, don't like to eat equals not delivering supplies, normal price is not expensive.",1,1,0,0,0,0
chn_train_track_b_01275,"At first, Wuhan was besieged, how many Hubeians fled back to Guangzhou, only the people behind the epidemic knew, we also said that Wuhan was refueled.",0,0,0,0,0,0
chn_train_track_b_01276,"Can't the passenger handle it? Can't the passenger police handle it? Can't the passenger police handle it? If these three are Chinese, what would be the situation?",1,0,0,0,0,0
chn_train_track_b_01277,"Either the reporting, even if there is a deviation, should be close to the actual, or simply not reported, this number is already a decent single-player game!",1,0,0,0,0,0
chn_train_track_b_01278,"Good morning, every day you have to move the bricks, that day you have to be full of energy, you have to be full of energy to move the bricks.",0,0,0,2,0,0
chn_train_track_b_01279,"I think the Chinese are always with the mud, the Chinese have to have fun, no matter how the Chinese athletes and the swimming team are not he certainly can not be the Chinese when people are fighting for the country, there is something that the Chinese have to give the Chinese side, he deals with the process is to listen to the National Sports Directorate should support the Chinese, the Chinese eat stimulants abroad and the people support it, we are not yet like this",1,1,0,0,0,0
chn_train_track_b_01280,"About the Guangzhou epidemic, I think the control is too bizarre <unk> I also do not understand this practice <unk> to be honest, the government control is difficult, there is a shortage of manpower and all kinds of real problems, but it is difficult for me to imagine the third year of the epidemic, our various preventive measures are so incomplete, the means of controlling the epidemic are so confused <unk> as a person who does not dare to go down the floor except to make nucleic acid, but still sunny, really do not know what to say <unk>",2,1,0,0,0,0
chn_train_track_b_01281,"The Henan Provincial Public Security Office sent a gift to the provincial grassroots traffic police, took away the execution of the detention center for drunk driving offenders, which was previously carried out by the court, and handed it over to the grassroots traffic police, who did a good job of being a good cop.",1,0,0,0,0,0
chn_train_track_b_01282,"<unk> Mid-summer night dream optimization <unk> Mid-summer night dream exit animation remake! Background cannibalistic flower sea redesigned! The background of mid-summer night dream should be quiet <unk> aesthetic, not dense cannibalistic flower! <unk> Two optimizations in almost two years time not even the exit split mirror has a design? <unk> Sit back, bring back the original sitting posture playing butterfly! <unk>",2,0,0,0,0,1
chn_train_track_b_01283,"Even if you do two days of nucleic acid and it doesn't work, and then some places ask for 48 hours, isn't that hard?",2,0,0,0,0,1
chn_train_track_b_01284,"First of all, it should not be targeted to the region, in an environment of increasing the daily number of outbreaks, people will definitely be emotionally anxious. I am also in the lockdown area, staff have to run legs to register to contact them by phone. They are really busy, residents should understand each other and cooperate.",0,0,0,0,0,0
chn_train_track_b_01285,"It hurts those kids, especially the one who was dumped in the hall by his mother, the kids should be desperate.",0,0,0,0,2,0
chn_train_track_b_01286,"I've been adjusting my mindset since I found out about my sexuality, I've been telling my family and friends and colleagues that I'm fine, I'm afraid they're worried that if something like this happens today, how can you let me trust the government?",2,0,0,0,0,0
chn_train_track_b_01287,"I like the words of a spokesperson, ""There are 1.4 billion people, everyone has the right to express their thoughts and feelings online"".",0,0,0,0,0,0
chn_train_track_b_01288,"Some people, if they don't think straight, feel that the whole world is like that!",1,0,0,0,0,0
chn_train_track_b_01289,"Can you say something like that, show that you've already done it!!!! Are you a monkey? A little editor, can you move your brain?",2,0,0,0,0,0
chn_train_track_b_01290,"This is a reasonable question, no malice, it will make me calmly read it all. In fact, Jiang Zemin's case is simple, first of all to break down the time. The impression of fundraising is that before borrowing 910,000, if it is certain that it cannot say how she fraudulently fundraised in the past. Other follow-up responses to the question of charity, to divide the emotions, in this opposite such a clear black hole incident, Jiang Zemin jumped in response I can partially understand.",0,0,0,0,0,0
chn_train_track_b_01291,"The rest of your life, the best way to live, is two words: live in your own world, live in someone else's world naturally.",0,0,0,0,0,0
chn_train_track_b_01292,"Baby two point black review reply black praise so glass heart as what marketing number ah, online is not vulnerable",1,0,0,0,0,0
chn_train_track_b_01293,"You're like the sun in the sky, although it's not enough, but as soon as you get a little closer, you feel warm.",0,0,0,2,0,0
chn_train_track_b_01294,"<unk> The virus is too small, Henan this time the source of the epidemic is a low risk <unk> nucleic acid negative <unk> in case of another outbreak, who is responsible? The media is responsible?",1,0,0,0,0,0
chn_train_track_b_01295,"A man who has at least one dream, has one reason to be strong. If the heart has no resting place, wherever it goes, it wanders.",0,0,0,0,0,0
chn_train_track_b_01296,"Thank you firefighters police uncle paramedics and volunteer team everyone hardworked, thank you all's hardwork paid out",0,0,0,2,0,0
chn_train_track_b_01297,"Chinese people are good and obedient to command, collective weight is greater than individual <unk> current epidemic, everyone does their best to avoid adding trouble to the country <unk> but low risk does not let home, and does not let home every year, so when can you go home <unk> if there is tightness, fluidity will quickly isolate, want to go and can not go <unk> please ask what is the meaning of the itinerary sign star, this star is the excuse for the regime <unk>",1,0,0,0,0,0
chn_train_track_b_01298,"Look at the fire that burned for nine days and eight nights, it all turned to ashes, how many people lost their homes overnight, if it wasn't for these fighters who fought to the death, I don't know how many more people would be displaced, the people of Shinjuku will never forget you.",0,0,0,0,3,0
chn_train_track_b_01299,"You should find some men who are trained to be particularly big in chest muscles and hips, you should get rid of the consumer group.",0,0,0,0,0,0
chn_train_track_b_01300,"Rich strong democracy civilization harmony, freedom equality justice rule of law, patriotism dedication integrity friendship 24 words core values divided into 3 levels: rich strong democracy civilization harmony, is value goal at the national level; freedom equality justice rule of law, is value orientation at the social level; patriotism dedication integrity friendship, is value guideline at the individual level",0,0,0,0,0,0
chn_train_track_b_01301,"Shenzhen in March took over 7 days of citywide silence, the epidemic was directly controlled <unk> due to the geographical location, there have been sporadic outbreaks in the background, but through precise prevention and control, the life of the area without the epidemic is not affected <unk> each time can be very well controlled, does not spread, has made everyone's life affected by the epidemic to a minimum <unk> unfortunately, where it is contained, life security is done very well <unk>",0,0,0,0,0,0
chn_train_track_b_01302,"If he doesn't promise, the fish shop won't last, the little dragon and the little tiger will continue to bully him, life will be a problem first, the little brother won't be able to open the door, it's almost tens of thousands of dollars.",0,0,0,0,0,0
chn_train_track_b_01303,"Every one of the people who bought the product are paying for this dance, which is why the reason why the live broadcast was stopped",0,0,0,0,0,0
chn_train_track_b_01304,"What's the point of thinking about something, really talking about it, what's the point of hiding it? I hate this self-righteous victim guilt theory the most!!",2,0,0,0,0,0
chn_train_track_b_01305,"If it's really a high-risk area, the health code itinerary code can't be green, how can it be in a restricted area? Now the policy of Henan Province is that the itinerary code with the star is directly isolated. Under such a big policy, only such a video exists. I believe that the vast majority of people are willing to follow the normal prevention rules, but a one-size-fits-all policy plus the word ""malignant return home"" makes people cold.",1,0,0,0,1,0
chn_train_track_b_01306,"The coconut tree group really misses the face of the Great Hainan, the coconut juice is so good to drink, why not go to the high-end temperament route! Now the coconut juice is not as good to drink as before, it's like water!",1,0,0,0,0,0
chn_train_track_b_01307,"Does anyone understand, please explain, the actions of the Municipal Supervisory Board are not an abuse of power, selective enforcement?",1,0,0,0,0,0
chn_train_track_b_01308,"Haha, Haha, the people of the stone farm laughed. How dare you come to the stone farm? Let it go for a week, no nucleic acid, do you know how much sunshine there is?",1,0,0,0,0,0
chn_train_track_b_01309,"Young people from ordinary families, who really want to be dragged around for a lifetime by a house, can't breathe at all, remind me of the 32 silver coins of the Qing Dynasty.",0,0,0,0,2,0
chn_train_track_b_01310,"14 years ago, Li Weiqian, who was 13 years old when he started primary school in Hokkaido, has now grown up to be a people's policeman.",0,0,0,0,0,0
chn_train_track_b_01311,"Don't expect any holidays! <unk> Others go to work, we go to work, others rest, we go to work, there is no special break, <unk>",2,0,0,0,1,1
chn_train_track_b_01312,"You're the one who came up with the rules to change this situation! What's the use of commenting every day? As someone who was cut by a knife and wanted to return, but was also labeled as ""an evil return to the country"", I saw this hot search.",3,0,0,0,0,0
chn_train_track_b_01313,"There are really problems with propaganda, scientific propaganda is lagging behind, data is not transparent, credibility is low, the common people are confused, anyway spending money to buy medicine is also a matter of action, it's easier than looking at scientific articles.",1,0,0,0,0,0
chn_train_track_b_01314,"Oh, my God, the smell has changed in the mouth of the official, you haven't even said it, you haven't said it, no one knows!!!",2,0,0,0,1,0
chn_train_track_b_01315,"I don't really need a map gun. I know people who know that the grid is very safe, temporarily no sunshine, maintaining it should be able to be downgraded soon. And the eligible green code Hubei people now have a chance to go home, these days are coordinated.",0,0,0,0,0,0
chn_train_track_b_01316,"I saw the sky rise in July, the only thing you're sorry about today is the cloudy weather, but at least this way you don't have to think about being sunburned. I saw the shoes I was wearing that day, after I went back to the beach, until now the marks of the sunburn on my feet are still clearly visible.",0,0,0,1,0,0
chn_train_track_b_01317,"14:28 to see the memorial, to see the change today, to see the children rescued from the ruins now paying tribute to their homeland, to pay homage, may there be no more disasters",0,0,0,1,1,0
chn_train_track_b_01318,"This is not a service issue, this is a problem of implementing epidemic prevention and control measures, it is a problem of maintaining public safety, if this is the case, not taking measures is in itself flawed, it should not be pushed aside.",1,0,0,0,0,0
chn_train_track_b_01319,"Some people say that Guangzhou is an outsider, my family is a foreigner who has lived in Guangzhou for more than twenty years, so far not a single native of Guangzhou has excluded our family.",0,0,0,0,0,0
chn_train_track_b_01320,"A good, diligent, hardworking person only asks for three meals of warmth, a steady job, it's as simple as that.",0,0,0,1,0,0
chn_train_track_b_01321,"Shocked, Apple encountered bottleneck difficulties for a long time due to charging port technology, could not break through, causing Apple to use Huawei mouth, the world's hundred-year-old unprecedented big change has quietly opened the curtain!",0,0,0,0,0,2
chn_train_track_b_01322,"A year without a few bucks, buying a house means owing a lot of money.",0,0,0,0,1,0
chn_train_track_b_01323,"What is that place? how are there so many black houses? people without ID cards, most likely is the murderer of the fugitive who set fire to people and not one or two......",1,0,1,0,0,1
chn_train_track_b_01324,"Whatever the premise, <unk>the words spoken by the county governor of the city and county, Dong Hong, are a legally blind speech<unk> but this is the level of thought and business of a leading cadre, no matter what consideration he is in, no matter whether he is intentionally good or not, this extremely rude speech is a true reflection of the fact that many current officials have no idea of serving the people, full of mind are officials<unk>",1,1,0,0,0,0
chn_train_track_b_01325,"No epidemic, 9 days is still very much expected  there is an epidemic, there is school related staff, holidays stay at home",0,0,0,0,1,0
chn_train_track_b_01326,"The smile of this little brother has healed! Thank you for his good manners, and I'm going to move seriously!",0,0,0,2,0,0
chn_train_track_b_01327,Can a court-ordered fine be collected through online fundraising? Or is there no similar provision in the current law?,1,1,0,0,0,0
chn_train_track_b_01328,"The good ones are in the area of 10,000, the bad ones are in 7,000, the towns have the lowest salary of 6,000, the salaries of 3,000 and more to 5,000, and Chengdu is one of the poorest counties in the country.",0,0,0,0,0,0
chn_train_track_b_01329,"Life is an eternally heavy effort, an effort to keep oneself in the midst of oneself, an effort not to lose one's direction, an effort to be firmly in one's place.",0,0,0,0,0,0
chn_train_track_b_01330,"The good thing about Weibo is that there are a lot of people who dare to speak out and many of them are young people, so that people do not despair.",0,0,0,1,0,0
chn_train_track_b_01331," simple rudeness, is characteristic of abuse of power, is to make life-threatening, is to refuse people a thousand cold, is cold poison of the human heart, such a working method, can only be effective isolation with the people distancing the heart from the devil although blocking the spread of the virus, but abuse <unk> detention <unk> but cutting off the blood-flesh connection with the masses of the people <unk> remember, <unk> isolation is the need for prevention, not detention county governor <unk>",2,0,0,0,0,0
chn_train_track_b_01332,"It's cleaning up the family, cleaning up the family, my family is rich, but my family's, not mine. That's what it means.",0,0,0,0,0,0
chn_train_track_b_01333,"Most of the Hubeians are still good, many of them are from the countryside of the past, which in Hubei folklore is more adulterous than the countryside of the past.",0,0,0,0,0,0
chn_train_track_b_01334,"You give me a good check, apart from this wave of outbreaks since October this year, which outbreak has occurred in Guangzhou since the Kangle River?",2,0,0,0,0,0
chn_train_track_b_01335,"Your clock, your clock, your love, your love, your everything, your wishes must be fulfilled.",0,0,0,3,0,0
chn_train_track_b_01336,"This place in Kangle Village is a mess made by nine birds, to kill you, it is strongly recommended to mobilize the armed police to suppress you.",2,0,0,0,0,0
chn_train_track_b_01337,"One day, we will all learn to heal ourselves, because it is a necessary lesson of life.",0,0,0,0,0,0
chn_train_track_b_01338,"What can be done about unhappiness? It's really something to be happy about, and it's okay to keep it locked up. Is it okay to be happy about being free?",1,1,0,0,0,0
chn_train_track_b_01339,"My father's mother-in-law, this year it's impossible to move, it's going to explode, my mother is going to die, I advised her that 2022 will be good.",0,0,0,0,0,0
chn_train_track_b_01340,"The clouds, the mountains, the rivers, the waters, the heavens, the earth, the earth, all things are born to the light, and I, besides the light, am born to her.",0,0,0,2,0,0
chn_train_track_b_01341,"The layers of prevention and control of the epidemic in the cities of Henan Province, the cross-city return to the homeland is more bizarre, the return from Luoyang to Zhouquan must be isolated nucleic acid, a city is more than a city.",1,0,0,0,0,0
chn_train_track_b_01342,"The point is that now they are sent back to Hubei for free, they don't come back, they have to run back to the station, why is this? They feel that they haven't eaten, they haven't lived, they haven't walked, they don't have deep water.",1,0,0,0,0,0
chn_train_track_b_01343,"He means that he thinks he can go back, he can go back, he thinks it's malicious, he's malicious, he's detained, he's detained, whatever he says, it's all 2022, and there's this guy who's an officer, it's just weird.",2,1,0,0,0,1
chn_train_track_b_01344,"The average is more than four thousand, the lowest is three thousand, the most expensive is more than six thousand. The price of housing in the neighboring counties is very low, my little sister lives there, the type of house is good, 118 square meters, lighting and surrounding facilities are good, close to kindergarten and primary school, the price is only three thousand.",0,0,0,0,0,0
chn_train_track_b_01345,"There's a lot of drama on this kind of subject, I've seen lurking, this time I heard that he's acting, otherwise I don't care.",0,0,0,0,0,0
chn_train_track_b_01346,"Of course talent is important, but I don't like the idea that she conveys, the subconscious is denying the value of effort, telling everyone that you don't have to work hard.",0,0,0,0,0,0
chn_train_track_b_01347,"My parents and my family still walk, and on birthdays and holidays, they get together, a little bit far away, unless they walk a lot, they rarely communicate, and I feel that the old man is there, and the old man who is very careful about these things can still have some contact.",0,0,0,0,0,0
chn_train_track_b_01348,"In the end, it's too much to desire, even if it's a momentary joy, but every moment I miss the power that can't be reached, that can't be reached, to embrace me in my arms.",0,0,0,1,0,0
chn_train_track_b_01349,"I'm still in Shenzhen at the beginning of the year, I just passed through Guangzhou in May, on the epidemic of nucleic acid testing, Guangzhou even a street in Shenzhen is not comparable to the nucleic acid point location setting strange, time and conflict, completely do not consider the time of people at work, set and not scientific, even check the nucleic acid point must look at the local community notification, cross-district work want to do a nucleic acid is difficult <unk> queue leader I did not say, basically all of the above causes caused, you say and Shenzhen <unk> comparable",1,1,0,0,0,0
chn_train_track_b_01350,"If you put all the public holidays of a month in the eleventh, you should be able to take 12 days off. If you put all the public holidays of the previous two months in the eleventh, you should be able to take 20 days off.",0,0,0,0,0,0
chn_train_track_b_01351,"A bunch of pretty, fresh-faced, well-built beautiful women dancing in a live broadcast, what's the problem? Where's the vulgarity? When you see a white rabbit, you think of sex, right? The person who reports it is a potential rapist.",1,1,0,0,0,0
chn_train_track_b_01352,"He was very clever, he knew where the pain came from, and he knew where the pain was going after it, so he said, ""One way, one way, one way"".",0,0,0,1,0,0
chn_train_track_b_01353,"I think more, my home <unk> the small towns of the 789 line are 78,000, the good land has already exceeded 10,000 <unk>",0,0,0,0,0,0
chn_train_track_b_01354,"The village and the unit are watching... if the meeting tomorrow doesn't mention how to arrange the nucleic acid, it is estimated that they will have to stay at home later.",0,0,0,0,0,0
